URL,Version,Status,OIDs,Name,Title,Descriptino,Uses,Used,Sources
http://hl7.org/fhir/ValueSet/address-type,5.0.0,active,"2.16.840.1.113883.4.642.3.69",AddressType,AddressType,"The type of an address (physical / postal).","StructureDefinition/at-core-patient,StructureDefinition/at-core-address","hl7.fhir.r5.core"
http://hl7.org/fhir/ValueSet/address-use,5.0.0,active,"2.16.840.1.113883.4.642.3.67",AddressUse,AddressUse,"The use of an address.","StructureDefinition/at-core-patient,StructureDefinition/at-core-address","hl7.fhir.r5.core"
http://hl7.org/fhir/ValueSet/administrative-gender,5.0.0,active,"2.16.840.1.113883.4.642.3.1",AdministrativeGender,AdministrativeGender,"The gender of a person used for administrative purposes.","StructureDefinition/at-core-practitioner,StructureDefinition/at-core-patient","hl7.fhir.r5.core"
http://hl7.org/fhir/ValueSet/all-languages,5.0.0,active,"2.16.840.1.113883.4.642.3.21",AllLanguages,All Languages,"This value set includes all possible codes from BCP-47 (see http://tools.ietf.org/html/bcp47)","StructureDefinition/at-core-practitioner,StructureDefinition/at-core-valueset,StructureDefinition/at-core-organization,StructureDefinition/at-core-patient,StructureDefinition/at-core-practitionerRole","hl7.terminology.r5"
http://hl7.org/fhir/ValueSet/c80-practice-codes,5.0.0,active,"2.16.840.1.113883.4.642.2.134,2.16.840.1.113883.3.88.12.80.72",PracticeSettingCodeValueSet,Practice Setting Code Value Set,"This is the code representing the clinical specialty of the clinician or provider who    interacted with, treated, or provided a service to/for the patient. The value set used    for clinical specialty has been limited by HITSP to the value set reproduced from HITSP    C80 Table 2-149 Clinical Specialty Value Set Definition.","StructureDefinition/at-core-practitionerRole","SCT"
http://hl7.org/fhir/ValueSet/contact-point-system,5.0.0,active,"2.16.840.1.113883.4.642.3.71",ContactPointSystem,ContactPointSystem,"Telecommunications form for contact point.","StructureDefinition/at-core-patient","hl7.fhir.r5.core"
http://hl7.org/fhir/ValueSet/contact-point-use,5.0.0,active,"2.16.840.1.113883.4.642.3.73",ContactPointUse,ContactPointUse,"Use of contact point.","StructureDefinition/at-core-patient","hl7.fhir.r5.core"
http://hl7.org/fhir/ValueSet/definition-topic,5.0.0,draft,"2.16.840.1.113883.4.642.3.794,2.16.840.1.113883.4.642.3.777",DefinitionTopic,Definition Topic,"High-level categorization of the definition, used for searching, sorting, and filtering.","StructureDefinition/at-core-valueset","THO"
http://hl7.org/fhir/ValueSet/designation-use,5.0.0,active,"2.16.840.1.113883.4.642.3.259,2.16.840.1.113883.4.642.3.264,2.16.840.1.113883.4.642.2.281",DesignationUse,Designation Use,"Details of how a designation would be used","StructureDefinition/at-core-valueset","SCT"
http://hl7.org/fhir/ValueSet/filter-operator,5.0.0,active,"2.16.840.1.113883.4.642.3.478,2.16.840.1.113883.4.642.2.280,2.16.840.1.113883.4.642.3.471",FilterOperator,Filter Operator,"The kind of operation to perform as a part of a property based filter.","StructureDefinition/at-core-valueset","hl7.fhir.r5.core"
http://hl7.org/fhir/ValueSet/identifier-type,5.0.0,active,"2.16.840.1.113883.4.642.3.45",IdentifierTypeCodes,Identifier Type Codes,"A coded type for an identifier that can be used to determine which identifier to use for a specific purpose.","StructureDefinition/at-core-practitioner,StructureDefinition/at-core-organization","THO (V2)"
http://hl7.org/fhir/ValueSet/identifier-use,5.0.0,active,"2.16.840.1.113883.4.642.3.57",IdentifierUse,IdentifierUse,"Identifies the purpose for this identifier, if known .","StructureDefinition/at-core-practitioner,StructureDefinition/at-core-organization,StructureDefinition/at-core-patient","hl7.fhir.r5.core"
http://hl7.org/fhir/ValueSet/jurisdiction,5.0.0,draft,"2.16.840.1.113883.4.642.3.48",JurisdictionValueSet,Jurisdiction ValueSet,"This value set defines a base set of codes for country, country subdivision and region    for indicating where a resource is intended to be used.             Note: The codes for countries and country subdivisions are taken from    [ISO 3166](https://www.iso.org/iso-3166-country-codes.html)    while the codes for ""supra-national"" regions are from    [UN Standard country or area codes for statistical use (M49)](http://unstats.un.org/unsd/methods/m49/m49.htm).","StructureDefinition/at-core-valueset","hl7.terminology.r5,Other"
http://hl7.org/fhir/ValueSet/languages,5.0.0,active,"2.16.840.1.113883.4.642.3.891,2.16.840.1.113883.4.642.3.20",CommonLanguages,Common Languages,"This value set includes common codes from BCP-47 (see http://tools.ietf.org/html/bcp47)","StructureDefinition/at-core-practitioner,StructureDefinition/at-core-valueset,StructureDefinition/at-core-organization,StructureDefinition/at-core-patient,StructureDefinition/at-core-practitionerRole","hl7.terminology.r5"
http://hl7.org/fhir/ValueSet/link-type,5.0.0,active,"2.16.840.1.113883.4.642.2.234,2.16.840.1.113883.4.642.3.423,2.16.840.1.113883.4.642.3.412",LinkType,Link Type,"The type of link between this Patient resource and another Patient/RelatedPerson resource.","StructureDefinition/at-core-patient","hl7.fhir.r5.core"
http://hl7.org/fhir/ValueSet/marital-status,5.0.0,active,"2.16.840.1.113883.4.642.3.29",MaritalStatusCodes,Marital Status Codes,"This value set defines the set of codes that can be used to indicate the marital status of a person.","StructureDefinition/at-core-patient","THO (V3)"
http://hl7.org/fhir/ValueSet/name-use,5.0.0,active,"2.16.840.1.113883.4.642.3.65",NameUse,NameUse,"The use of a human name.","StructureDefinition/at-core-patient","hl7.fhir.r5.core"
http://hl7.org/fhir/ValueSet/patient-contactrelationship,5.0.0,active,"2.16.840.1.113883.4.642.3.1130",PatientContactRelationship,Patient Contact Relationship ,"The nature of the relationship between the patient and the contact person.","StructureDefinition/at-core-patient","THO (V2)"
http://hl7.org/fhir/ValueSet/publication-status,5.0.0,active,"2.16.840.1.113883.4.642.3.3",PublicationStatus,PublicationStatus,"The lifecycle status of an artifact.","StructureDefinition/at-core-valueset","hl7.fhir.r5.core"
http://hl7.org/fhir/ValueSet/resource-types,5.0.0,active,"2.16.840.1.113883.4.642.3.27",ResourceType,Resource Types,"Concrete FHIR Resource Types","StructureDefinition/at-core-practitioner,StructureDefinition/at-core-organization,StructureDefinition/at-core-patient","hl7.fhir.r5.core"
http://hl7.org/fhir/ValueSet/service-mode,5.0.0,draft,"2.16.840.1.113883.4.642.4.3322",ServiceMode,Service Mode,"An example set of Service Modes that could be applicable to use to characterize HealthcareServices or PractitionerRoles while searching","StructureDefinition/at-core-practitionerRole","hl7.fhir.r5.core"
http://hl7.org/fhir/ValueSet/version-algorithm,5.0.0,draft,"2.16.840.1.113883.4.642.3.3103",VersionAlgorithm,Version Algorithm,"Indicates the mechanism used to compare versions to determine which is more current.","StructureDefinition/at-core-valueset","hl7.fhir.r5.core"
http://terminology.hl7.org/ValueSet/contactentity-type,1.0.0,draft,"2.16.840.1.113883.4.642.3.416",ContactEntityType,Contact entity type,"This example value set defines a set of codes that can be used to indicate the purpose for which you would contact a contact party.","StructureDefinition/at-core-extendedContactDetail","THO"
http://terminology.hl7.org/ValueSet/v2-0360,2.0.0,active,"2.16.840.1.113883.21.236",Hl7VSDegreeLicenseCertificate,hl7VS-degreeLicenseCertificate,"Concepts specifying an educational degree (e.g., MD).  Used in the CNN datatype (names and identifiers of clinicians) in Version 2 messaging.  Used in Version 2 messaging; note that in releases of HL7 prior to 2.3.1, was also used in person names (XPN), but this use was deprecated, then withdrawn in 2.7.","StructureDefinition/at-core-practitioner","THO (V2)"
