URL,Version,Status,OIDs,Name,Title,Descriptino,Used
https://fhir.ehealth-systems.at/artifacts/PlanDefinition/tag,0.1.0,active,,KIOLAStandardTreatmentPlanTagCS,KIOLA Standard Treatment Plan Code System,"Meta data tags of standard treatment plans.",
https://fhir.ehealth-systems.at/kiola/boolean,0.1.0,active,,KIOLABooleanCS,KIOLA Boolean,"",
https://fhir.ehealth-systems.at/kiola/careplan/category,0.1.0,active,,KIOLACarePlanCategoryCS,KIOLA Care Plan Category Code System,"Categories of care plans supported by KIOLA.",
https://fhir.ehealth-systems.at/kiola/careplan/transient-tag,0.1.0,active,,KIOLACarePlanTransientTagCS,KIOLA Care Plan Transient Tag Code System,"Meta data tags of care plans that should be removed when creating an updated plan for a patient, in case an activity changes.",
https://fhir.ehealth-systems.at/kiola/device,0.1.0,active,,KIOLADeviceCS,KIOLA Device Codes,"Generic device types that can transmit vital data.",
https://fhir.ehealth-systems.at/kiola/device/AIT-11073,0.1.0,active,,KIOLAMDCCS,KIOLA Device Codes AIT 11073,"Measurement device types for automatic transmission of measurements and their configuration parameters, based on the ISO/IEEE 11073 standard with vendor-specific extensions, mainly AIT. The MDC display name is used as a code.",
https://fhir.ehealth-systems.at/kiola/device/kmc,0.1.0,active,,KIOLADeviceKMCCS,KMC Device Codes,"Various codes that might be used to configure a mobile client.",
https://fhir.ehealth-systems.at/kiola/dimension/AIT-11073,0.1.0,active,,KIOLAMDCDIMCS,KIOLA Dimension Codes AIT 11073,"Measurement dimensions supported by KIOLA, based on the ISO/IEEE 11073 standard with vendor-specific extensions, mainly AIT. The MDC display name is used as a code.  All codes might be parametrized using the syntax `CODE:{min=MIN_VAL,max=MAX_VAL}` to define a plausibility range for manual data entry, e.g.: `MDC_DIM_MILLI_G_PER_DL:{min=0,max=1000}`",
https://fhir.ehealth-systems.at/kiola/measurement,0.1.0,active,,KIOLAMeasurementCS,KIOLA Measurement Codes,"Types of vital data measurements that can be transmitted to a KIOLA system. The naming is derived from MDC display names of devices from the ISO/IEEE 11073 standard.",
