URL,Version,Status,OIDs,Name,Title,Descriptino,Uses,Used,Sources
https://ema.europa.eu/fhir/vs/domain,0.1.0,active,,DomainVs,The Domain Value Set,"","StructureDefinition/at-emed-MedicinalProductDefinition","Internal"
https://ema.europa.eu/fhir/vs/ingredientRole,0.1.0,active,,IngredientRoleVs,The Ingredient Role Value Set,"",,"Internal"
https://ema.europa.eu/fhir/vs/legalStatusForTheSupply,0.1.0,active,,LegalStatusForTheSupplyVs,The Legal Status of Supply Value Set,"",,"Internal"
https://ema.europa.eu/fhir/vs/pharmaceuticalDoseForm,0.1.0,active,,PharmaceuticalDoseFormVs,The Pharmaceutical Dose Form Value Set,"",,"Internal"
https://ema.europa.eu/fhir/vs/productNamePartType,0.1.0,active,,MedicinalProductNamePartTypeVs,The Medicinal Product Name Part Type,"","StructureDefinition/at-emed-MedicinalProductDefinition","Internal"
https://ema.europa.eu/fhir/vs/quantityOperator,0.1.0,active,,QuantityOperatorVs,The Quantity Operator Value Set,"",,"Internal"
https://ema.europa.eu/fhir/vs/regulatoryEntitlementStatus,0.1.0,active,,RegulatoryEntitlementStatusVs,The Regulatory Entitlement Status Value Set,"","StructureDefinition/at-emed-MarketingRegulatedAuthorization","Internal"
https://ema.europa.eu/fhir/vs/regulatoryEntitlementType,0.1.0,active,,RegulatoryEntitlementTypeVs,The Regulatory Entitlement Type Value Set,"",,"Internal"
https://ema.europa.eu/fhir/vs/unitsOfPresentation,0.1.0,active,,UnitsOfPresentationVs,The Units of Presentation Value Set,"","StructureDefinition/at-emed-PackagedProductDefinition","Internal"
